{
  "format_version": 3,
  "generator_version": 3,
  "profile_id": "selene-gql-core-2.0",
  "selected_features": [
    "G002",
    "G003",
    "G010",
    "G011",
    "G012",
    "G013",
    "G014",
    "G015",
    "G016",
    "G017",
    "G018",
    "G019",
    "G020",
    "G036",
    "G037",
    "G060",
    "G061",
    "G100",
    "G110",
    "G111",
    "G112",
    "G113",
    "G114",
    "G115",
    "GA01",
    "GA05",
    "GA06",
    "GA07",
    "GC01",
    "GC02",
    "GC03",
    "GC04",
    "GC05",
    "GD01",
    "GE04",
    "GE05",
    "GE06",
    "GE07",
    "GF01",
    "GF02",
    "GF03",
    "GF04",
    "GF05",
    "GF06",
    "GF07",
    "GF10",
    "GF11",
    "GF12",
    "GF13",
    "GF20",
    "GG01",
    "GG02",
    "GG20",
    "GG21",
    "GH02",
    "GL01",
    "GL02",
    "GL03",
    "GL04",
    "GL05",
    "GL06",
    "GL07",
    "GL08",
    "GL09",
    "GL10",
    "GL11",
    "GP01",
    "GP02",
    "GP03",
    "GP04",
    "GQ02",
    "GQ03",
    "GQ04",
    "GQ05",
    "GQ06",
    "GQ07",
    "GQ08",
    "GQ09",
    "GQ10",
    "GQ11",
    "GQ12",
    "GQ13",
    "GQ14",
    "GQ15",
    "GQ16",
    "GQ18",
    "GQ20",
    "GQ24",
    "GS03",
    "GS04",
    "GS07",
    "GS08",
    "GS15",
    "GS16",
    "GT01",
    "GV01",
    "GV02",
    "GV03",
    "GV04",
    "GV05",
    "GV06",
    "GV07",
    "GV08",
    "GV09",
    "GV10",
    "GV11",
    "GV12",
    "GV13",
    "GV14",
    "GV17",
    "GV18",
    "GV19",
    "GV21",
    "GV22",
    "GV23",
    "GV24",
    "GV30",
    "GV31",
    "GV32",
    "GV35",
    "GV36",
    "GV37",
    "GV38",
    "GV39",
    "GV40",
    "GV41",
    "GV45",
    "GV46",
    "GV47",
    "GV48",
    "GV50",
    "GV55",
    "GV66",
    "GV67",
    "GV68",
    "GV90"
  ],
  "release_claimable": false,
  "clause_anchors": [
    {
      "id": "CLAUSE-24.2",
      "citation": "ISO/IEC 39075:2024, Clause 24.2"
    },
    {
      "id": "CLAUSE-24.3",
      "citation": "ISO/IEC 39075:2024, Clause 24.3"
    },
    {
      "id": "CLAUSE-24.5",
      "citation": "ISO/IEC 39075:2024, Clause 24.5"
    },
    {
      "id": "CLAUSE-24.6",
      "citation": "ISO/IEC 39075:2024, Clause 24.6"
    },
    {
      "id": "CLAUSE-24.7",
      "citation": "ISO/IEC 39075:2024, Clause 24.7"
    },
    {
      "id": "CLAUSE-24.7-TABLE10-P517",
      "citation": "ISO/IEC 39075:2024, Clause 24.7, Table 10, p. 517"
    },
    {
      "id": "CLAUSE-24.7-TABLE10-P518",
      "citation": "ISO/IEC 39075:2024, Clause 24.7, Table 10, p. 518"
    },
    {
      "id": "CLAUSE-24.7-TABLE10-P519",
      "citation": "ISO/IEC 39075:2024, Clause 24.7, Table 10, p. 519"
    },
    {
      "id": "CLAUSE-24.7-TABLE10-P520",
      "citation": "ISO/IEC 39075:2024, Clause 24.7, Table 10, p. 520"
    },
    {
      "id": "CLAUSE-24.7-TABLE10-P521",
      "citation": "ISO/IEC 39075:2024, Clause 24.7, Table 10, p. 521"
    },
    {
      "id": "CLAUSE-ANNEX-B",
      "citation": "ISO/IEC 39075:2024, Annex B implementation-defined ID inventory"
    }
  ],
  "features": [
    {
      "id": "G002",
      "name": "Different-edges match mode",
      "runtime_support": "supported",
      "claim_state": "implemented_unclaimed",
      "unsupported_rationale": "",
      "runtime_order": 47,
      "clause_anchors": [],
      "evidence": [],
      "applicability": "APP-ALWAYS"
    },
    {
      "id": "G003",
      "name": "Explicit REPEATABLE ELEMENTS keyword",
      "runtime_support": "supported",
      "claim_state": "implemented_unclaimed",
      "unsupported_rationale": "",
      "runtime_order": 48,
      "clause_anchors": [],
      "evidence": [],
      "applicability": "APP-ALWAYS"
    },
    {
      "id": "G010",
      "name": "Explicit WALK keyword",
      "runtime_support": "supported",
      "claim_state": "implemented_unclaimed",
      "unsupported_rationale": "",
      "runtime_order": 49,
      "clause_anchors": [],
      "evidence": [],
      "applicability": "APP-ALWAYS"
    },
    {
      "id": "G011",
      "name": "Advanced path modes: TRAIL",
      "runtime_support": "supported",
      "claim_state": "implemented_unclaimed",
      "unsupported_rationale": "",
      "runtime_order": 50,
      "clause_anchors": [],
      "evidence": [],
      "applicability": "APP-ALWAYS"
    },
    {
      "id": "G012",
      "name": "Advanced path modes: SIMPLE",
      "runtime_support": "supported",
      "claim_state": "implemented_unclaimed",
      "unsupported_rationale": "",
      "runtime_order": 51,
      "clause_anchors": [],
      "evidence": [],
      "applicability": "APP-ALWAYS"
    },
    {
      "id": "G013",
      "name": "Advanced path modes: ACYCLIC",
      "runtime_support": "supported",
      "claim_state": "implemented_unclaimed",
      "unsupported_rationale": "",
      "runtime_order": 52,
      "clause_anchors": [],
      "evidence": [],
      "applicability": "APP-ALWAYS"
    },
    {
      "id": "G014",
      "name": "Explicit PATH/PATHS keywords",
      "runtime_support": "supported",
      "claim_state": "implemented_unclaimed",
      "unsupported_rationale": "",
      "runtime_order": 53,
      "clause_anchors": [],
      "evidence": [],
      "applicability": "APP-ALWAYS"
    },
    {
      "id": "G015",
      "name": "All path search: explicit ALL keyword",
      "runtime_support": "supported",
      "claim_state": "implemented_unclaimed",
      "unsupported_rationale": "",
      "runtime_order": 54,
      "clause_anchors": [],
      "evidence": [],
      "applicability": "APP-ALWAYS"
    },
    {
      "id": "G016",
      "name": "Any path search",
      "runtime_support": "supported",
      "claim_state": "implemented_unclaimed",
      "unsupported_rationale": "",
      "runtime_order": 55,
      "clause_anchors": [],
      "evidence": [],
      "applicability": "APP-ALWAYS"
    },
    {
      "id": "G017",
      "name": "All shortest path search",
      "runtime_support": "supported",
      "claim_state": "implemented_unclaimed",
      "unsupported_rationale": "",
      "runtime_order": 56,
      "clause_anchors": [],
      "evidence": [],
      "applicability": "APP-ALWAYS"
    },
    {
      "id": "G018",
      "name": "Any shortest path search",
      "runtime_support": "supported",
      "claim_state": "implemented_unclaimed",
      "unsupported_rationale": "",
      "runtime_order": 57,
      "clause_anchors": [],
      "evidence": [],
      "applicability": "APP-ALWAYS"
    },
    {
      "id": "G019",
      "name": "Counted shortest path search",
      "runtime_support": "supported",
      "claim_state": "implemented_unclaimed",
      "unsupported_rationale": "",
      "runtime_order": 58,
      "clause_anchors": [],
      "evidence": [],
      "applicability": "APP-ALWAYS"
    },
    {
      "id": "G020",
      "name": "Counted shortest group search",
      "runtime_support": "supported",
      "claim_state": "implemented_unclaimed",
      "unsupported_rationale": "",
      "runtime_order": 59,
      "clause_anchors": [],
      "evidence": [],
      "applicability": "APP-ALWAYS"
    },
    {
      "id": "G030",
      "name": "Null predicates",
      "runtime_support": "referenced",
      "claim_state": "unsupported",
      "unsupported_rationale": "",
      "runtime_order": 234,
      "clause_anchors": [],
      "evidence": [],
      "applicability": "APP-ALWAYS"
    },
    {
      "id": "G031",
      "name": "Non-nullable value types",
      "runtime_support": "referenced",
      "claim_state": "unsupported",
      "unsupported_rationale": "",
      "runtime_order": 235,
      "clause_anchors": [],
      "evidence": [],
      "applicability": "APP-ALWAYS"
    },
    {
      "id": "G032",
      "name": "Truth value operations",
      "runtime_support": "referenced",
      "claim_state": "unsupported",
      "unsupported_rationale": "",
      "runtime_order": 236,
      "clause_anchors": [],
      "evidence": [],
      "applicability": "APP-ALWAYS"
    },
    {
      "id": "G033",
      "name": "Extended truth value operations",
      "runtime_support": "referenced",
      "claim_state": "unsupported",
      "unsupported_rationale": "",
      "runtime_order": 237,
      "clause_anchors": [],
      "evidence": [],
      "applicability": "APP-ALWAYS"
    },
    {
      "id": "G036",
      "name": "Quantified edges",
      "runtime_support": "supported",
      "claim_state": "implemented_unclaimed",
      "unsupported_rationale": "",
      "runtime_order": 60,
      "clause_anchors": [],
      "evidence": [],
      "applicability": "APP-ALWAYS"
    },
    {
      "id": "G037",
      "name": "Questioned paths",
      "runtime_support": "supported",
      "claim_state": "implemented_unclaimed",
      "unsupported_rationale": "",
      "runtime_order": 61,
      "clause_anchors": [],
      "evidence": [],
      "applicability": "APP-ALWAYS"
    },
    {
      "id": "G038",
      "name": "Regular value specification",
      "runtime_support": "referenced",
      "claim_state": "unsupported",
      "unsupported_rationale": "",
      "runtime_order": 238,
      "clause_anchors": [],
      "evidence": [],
      "applicability": "APP-ALWAYS"
    },
    {
      "id": "G039",
      "name": "Extended value specification",
      "runtime_support": "referenced",
      "claim_state": "unsupported",
      "unsupported_rationale": "",
      "runtime_order": 239,
      "clause_anchors": [],
      "evidence": [],
      "applicability": "APP-ALWAYS"
    },
    {
      "id": "G041",
      "name": "Basic binding table expressions",
      "runtime_support": "referenced",
      "claim_state": "unsupported",
      "unsupported_rationale": "",
      "runtime_order": 240,
      "clause_anchors": [],
      "evidence": [],
      "applicability": "APP-ALWAYS"
    },
    {
      "id": "G044",
      "name": "List value constructors",
      "runtime_support": "referenced",
      "claim_state": "unsupported",
      "unsupported_rationale": "",
      "runtime_order": 241,
      "clause_anchors": [],